1,Крем ночной питательный для всех типов кожи,Крем нічний живильний для всіх типів шкіри,Lumene Basic Blue Night Cream,93
2,Лечебная крем-маска для волос с экстрактом семян льна,Лікувальна крем-маска для волосся з екстрактом насіння льону,Black Professional Line Linseeds Regenerating Hair Cream,90
3,Бальзам для губ,Бальзам для губ,Crazy Rumors Leaping Bunny Plum Apricot Lip Balm,63
4,Крем против морщин омолаживающий,Крем проти зморшок омолоджуючий,Centro Messegue Perfection Creme Jeunesse Antirides,1080
5,"Йогурт для тела с витаминными капсулами, экстрактами черной икры и орхидеи ","Йогурт для тіла з вітамінними капсулами, екстрактами чорної ікри і орхідеї",Mon Platin DSM Black Caviar Body Yogurt Orchid,766
6,"Бальзам для губ ""Кокос""","Бальзам для губ ""Кокос""",I Love Cosmetics Balmi Cube Coconut Lip Balm,239
7,Крем-пилинг для кожи головы против перхоти,Крем-пілінг для шкіри голови проти лупи,Biomed Trattamento Esfoliante Cute con Forfora,365
8,Восстанавливающая маска для губ,Відновлююча маска для губ,Petite Amie Miint Repairing Lip Mask Hey!,100
9,"Выравнивающая, разглаживающая маска","Вирівнююча, розгладжуюча маска",Maxima Beauty Sweet Relax Pak PH 5.0 MX Nook,263
10,Защитный крем для чувствительной кожи,Захисний крем для чутливої ​​шкіри,Capri Beauty Line Sensitive Skin Beta-Glycyrrhetic Acid and Phospholipids Protective Cream,381
11,"Парфюмированный спрей для тела ""Дикий рис и Розовый кедр""","Парфумований спрей для тіла ""Дикий рис і Рожевий кедр""",Grace Cole Boutique Wild Fig&Pink Cedar Body Mist,345
12,Крем для зоны вокруг глаз и губ,Крем для зони навколо очей і губ,Alissa Beaute Longevity Cellular Eye & Lip Cream,1053
13,Солнцезащитный крем с икрой SPF +50,Сонцезахисний крем з ікрою SPF +50,Dermastir Caviar Sun Protection SPF50+,1264
14,Травяной крем-гель с арникой,Трав'яний крем-гель з арнікой,Apivita Herbal Cream Gel With Arnica,345
15,Ночной крем Бамбук для жирной кожи,Нічний крем Бамбук для жирної шкіри,Attirance Bamboo Night Face Cream,585
16,Комфорт-маска для глубокого увлажнения волос,Комфорт-маска для глибокого зволоження волосся,Estel Professional Otium Aqua,350
17,Отбеливающая интенсивная эмульсия с SPF 15,Відбілююча інтенсивна емульсія з SPF 15,Declare Brightening Intensive Fluid SPF 15,481
18,"Освежающий спрей для тела ""Ваниль""","Освіжаючий спрей для тіла ""Ваніль""",I Love Vanilla Milk Body Mist,278
19,Крем для тела,Крем для тіла,Guam Inthenso Burro Crema Corpo,629
20,Препарат 3в1 для восстановления липидного слоя кожи,Препарат 3в1 для відновлення ліпідного шару шкіри,Pharmaceris E Emotopic Lipid-Replenishing Formula 3in1,659
21,"Лосьон для тела с помпой ""Клубника-анис""","Лосьйон для тіла з помпою ""Полуниця-аніс""",Greenland Fruit Emotions Body Lotion Strawberry-Anise With Pump,447
22,Омолаживающая эмульсия,Омолоджуюча емульсія,Jean D'Arcel No Age Serum,595
23,"Двухфазный мусс для тела ""Релакс""","Двофазний мус для тіла ""Релакс""",Babor Relaxing Bi-Phase Body Foam,1683
24,"Молочко для тела ""Зеленый чай-Грейпфрут-Малина""","Молочко для тіла ""Зелений чай-Грейпфрут-Малина""",Hempz Mash-Ups Calm & Citrusy Herbal Body Moisturizer,697
